{
  "schema": "rll.epistemic_void_ledger.v1",
  "ledger_id": "EVL-RLL-20260720",
  "updated_at": "2026-07-20T08:30:00Z",
  "purpose": "Convert uncertainty, contradiction and creative alternatives into explicit, testable and claim-bounded routes inside the RLL repository.",
  "claim_allowed": false,
  "operational_entropy_definition": "routing_metric_not_physical_entropy",
  "records": [
    {
      "id": "EV-RLL-PROVENANCE-001",
      "state": "READY_FOR_TEST",
      "priority": "P0",
      "domain": "scientific_provenance",
      "epistemic_class": "V",
      "question": "Which result should be current when a complete historical run and a newer partial run disagree by omission?",
      "known": [
        "RLL now has a structural run-manifest schema with field-level provenance.",
        "A partial execution can contain TOKEN_VAZIO for a field measured numerically in an earlier lineage."
      ],
      "unknowns": [
        "Historical runs have not all been materialized into the new manifest schema.",
        "No field-level precedence resolver is yet committed as the canonical implementation."
      ],
      "contradictions": [
        {
          "id": "C-RUN-STATE-001",
          "statement_a": "A historical complete artifact may contain a numerical Bayes result.",
          "statement_b": "A newer partial artifact may expose the same field as TOKEN_VAZIO.",
          "resolution_gate": "Materialize both manifests and evaluate precedence within a compatible lineage."
        }
      ],
      "possibilities": [
        {
          "id": "C-FIELD-PRECEDENCE",
          "classification": "C",
          "role": "convention",
          "statement": "Precedence is resolved per field and lineage instead of replacing the entire prior run.",
          "falsifier": null,
          "predicted_observation": null,
          "promotion_gate": "Encode the convention in a deterministic resolver and regression tests.",
          "claim_allowed": false
        },
        {
          "id": "H-LINEAGE-RESOLVER",
          "classification": "H",
          "role": "testable_hypothesis",
          "statement": "A lineage-aware resolver preserves valid numeric evidence while marking newer missing fields as non-superseding.",
          "falsifier": "The resolver selects a compatible TOKEN_VAZIO field over an earlier complete numeric result.",
          "predicted_observation": "The canonical snapshot retains the complete value and records the partial run as a non-superseding event.",
          "promotion_gate": "Pass resolver tests over at least one historical and one partial manifest.",
          "claim_allowed": false
        },
        {
          "id": "P-RIVER-LINEAGE",
          "classification": "P",
          "role": "analogy",
          "statement": "Runs are tributaries: a dry tributary does not erase water measured upstream.",
          "falsifier": null,
          "predicted_observation": null,
          "promotion_gate": "Translate only into lineage and precedence tests; never cite the analogy as evidence.",
          "claim_allowed": false
        }
      ],
      "exit_conditions": [
        {
          "id": "X-MANIFEST-PAIR",
          "evidence_required": "Two schema-valid manifests representing a complete and a partial compatible lineage.",
          "acceptance_criterion": "Both manifests validate and preserve distinct run, commit, method and artifact provenance.",
          "artifact_path": "results/run_manifests/reconciliation_pair.json",
          "command": "python tools/materialize_rll_run_manifest.py --reconcile-example"
        },
        {
          "id": "X-PRECEDENCE-TEST",
          "evidence_required": "Deterministic field-level resolver with regression coverage.",
          "acceptance_criterion": "TOKEN_VAZIO never supersedes compatible complete evidence and incompatible lineages remain separate.",
          "artifact_path": "artifacts/run-ledger/precedence_report.json",
          "command": "pytest -q tests/test_rll_result_precedence.py"
        }
      ],
      "creative_boundary": "creativity_generates_candidates_not_evidence",
      "conclusion": null,
      "resolution_evidence": [],
      "claim_allowed": false,
      "next_gate": "Implement manifest materialization and field-level precedence.",
      "source_refs": [
        "schemas/rll_run_manifest.schema.json",
        "docs/workflows/FASE_25_1_CONTRATO_EXECUTAVEL.md",
        "docs/science/TOKEN_VAZIO_PRIORITY_LEDGER.md"
      ]
    },
    {
      "id": "EV-RLL-GROWTH-001",
      "state": "TOKEN_VAZIO",
      "priority": "P1",
      "domain": "cosmology_growth",
      "epistemic_class": "V",
      "question": "Does an RLL parameter region remain compatible with independent growth-of-structure observations?",
      "known": [
        "The repository contains background-expansion and growth-related routes.",
        "Background compatibility alone does not establish perturbation or structure-growth compatibility."
      ],
      "unknowns": [
        "The canonical covariance-aware f_sigma8 likelihood and dataset lineage are not unified in one current run.",
        "The stability of viable parameters under joint background and growth constraints remains open."
      ],
      "contradictions": [],
      "possibilities": [
        {
          "id": "H-GROWTH-VIABLE",
          "classification": "H",
          "role": "testable_hypothesis",
          "statement": "At least one prior-bounded RLL parameter region is jointly compatible with background and f_sigma8 data.",
          "falsifier": "No sampled parameter region passes the preregistered joint fit and posterior-predictive thresholds.",
          "predicted_observation": "A stable posterior region remains after adding growth data without collapsing to a boundary artifact.",
          "promotion_gate": "Run a covariance-aware joint likelihood with preregistered priors and convergence diagnostics.",
          "claim_allowed": false
        },
        {
          "id": "H-GROWTH-EXCLUDES",
          "classification": "H",
          "role": "testable_hypothesis",
          "statement": "Independent growth data eliminate the background-compatible RLL region.",
          "falsifier": "A converged joint posterior retains a stable non-boundary RLL region under sensitivity checks.",
          "predicted_observation": "The posterior concentrates at a null or excluded boundary and predictive residuals remain unacceptable.",
          "promotion_gate": "Compare RLL, LCDM, wCDM and CPL under the same dataset lineage and priors.",
          "claim_allowed": false
        },
        {
          "id": "P-TWO-SHADOWS",
          "classification": "P",
          "role": "analogy",
          "statement": "Expansion and growth are two shadows of one object, but neither shadow proves the other.",
          "falsifier": null,
          "predicted_observation": null,
          "promotion_gate": "Use only to explain why independent likelihoods are required.",
          "claim_allowed": false
        }
      ],
      "exit_conditions": [
        {
          "id": "X-GROWTH-DATA",
          "evidence_required": "Versioned f_sigma8 dataset, covariance or uncertainty model, license and SHA-256.",
          "acceptance_criterion": "The dataset manifest is reproducible and no placeholder or synthetic row enters the real-data likelihood.",
          "artifact_path": "data/real/cosmology/fsigma8_manifest.json",
          "command": "python scripts/check_rll_growth.py --validate-data"
        },
        {
          "id": "X-GROWTH-JOINT",
          "evidence_required": "Joint posterior and posterior-predictive report using identical baselines and priors.",
          "acceptance_criterion": "Convergence, prior sensitivity and model-comparison outputs are all present and checksum-bound.",
          "artifact_path": "artifacts/cosmology-growth/joint_growth_report.json",
          "command": "python scripts/check_rll_growth.py --joint"
        }
      ],
      "creative_boundary": "creativity_generates_candidates_not_evidence",
      "conclusion": null,
      "resolution_evidence": [],
      "claim_allowed": false,
      "next_gate": "Unify real growth data, covariance and joint model comparison.",
      "source_refs": [
        "scripts/check_rll_growth.py",
        "docs/RLL_PERTURBATION_LAYER.md",
        "docs/science/TOKEN_VAZIO_PRIORITY_LEDGER.md"
      ]
    },
    {
      "id": "EV-RLL-GENERALIZATION-001",
      "state": "TOKEN_VAZIO",
      "priority": "P1",
      "domain": "out_of_sample_validation",
      "epistemic_class": "V",
      "question": "Does RLL performance generalize to observations not used for parameter selection or model construction?",
      "known": [
        "Optimization on the same observations used for evaluation can overstate apparent performance.",
        "The repository preserves multiple observational routes and model-comparison artifacts."
      ],
      "unknowns": [
        "A canonical train-test split or temporal preregistration contract is not yet attached to the full scientific run.",
        "Out-of-sample predictive calibration relative to LCDM, wCDM and CPL remains unmeasured."
      ],
      "contradictions": [],
      "possibilities": [
        {
          "id": "H-OOS-GENERALIZES",
          "classification": "H",
          "role": "testable_hypothesis",
          "statement": "RLL retains competitive predictive calibration on observations withheld from all fitting and design choices.",
          "falsifier": "Withheld-data residuals or predictive scores are materially worse than preregistered baselines.",
          "predicted_observation": "The held-out predictive distribution remains calibrated without post-hoc parameter adjustment.",
          "promotion_gate": "Freeze model, priors and split before revealing held-out scores.",
          "claim_allowed": false
        },
        {
          "id": "H-OOS-OVERFIT",
          "classification": "H",